ID,Name,Description
1,the edge of a forest,standing on the edge of an ancient forest
2,an old pathway,walking along a old path through the forest. Sunlight streams through the canopy above
3,an old pathway,following an old pathway between the ancient oak trees
4,a fork in the path,at a point in the pathway where the way forks in different directions. An old stone statue stands at the junction with a skull in its left hand and a bow in its right hand
5,a narrow track,following narrow track. You think you can make out footprints running east to west